key,title,year,month,day,journal,issn,volume,issue,pages,authors,url,language,publisher,location,abstract,notes
wittman_carbohydrate_2018,"Carbohydrate supply drives colony size, aggression, and impacts of an invasive ant",2018,1,1,ECOSPHERE,2150-8925,9,9,NA,"Wittman, Sarah E. and O'Dowd, Dennis J. and Green, Peter T. month = sep,",10.1002/ecs2.2403,,,,"Worldwide, the most ecologically damaging invasive ants are associated with introduced honeydew-producing insects, yet the mechanisms by which this mutualism may support invasive ant populations and drive impacts remain unclear. On Christmas Island, the invasive yellow crazy ant (Anoplolepis gracilipes; YCA), found in association with introduced honeydew-producing scale insects, can reach extraordinary densities, triggering an ecological meltdown. In this study, we utilized stable isotope analysis to determine resource use of YCAs in naturally occurring low- and high-density populations, and we conducted laboratory experiments mimicking availability of honeydew to measure effects of carbohydrate subsidies on colony growth and worker behavior. High-density YCA populations in nature incorporated a larger proportion of plant-based resources in their diet than low-density populations, and laboratory colonies with access to greater sugar resources had larger colony sizes, higher reproduction rates and worker survival, and higher per capita activity levels and showed higher aggression and potency toward opponents. These results support the positive feedback mechanism between honeydew-producing insects and YCAs that underlies the ecological meltdown on Christmas Island, and add to the growing body of literature illustrating the importance of mutualistic interactions in the success of invasive species."," RAYYAN-INCLUSION: {""Alfredo""=>""Included""}"
meisel_sexual_2018,Sexual conflict and the maintenance of genetic variation in natural populations,2018,1,1,MOLECULAR ECOLOGY,0962-1083,27,18,3569--3571,"Meisel, Richard P. month = sep,",10.1111/mec.14787,,,,"Understanding the factors that maintain genetic variation in natural populations is a foundational goal of evolutionary biology. To this end, population geneticists have developed a variety of models that can produce stable polymorphisms. In one of the earliest models, Owen (1953) demonstrated that differences in selection pressures acting on males and females could maintain multiple alleles of a gene at a stable equilibrium. If the selection pressures act in opposite directions in males and females, we refer to this as (inter-) sexual conflict or sexual antagonism (Arnqvist \& Rowe, 2005). Testing if sexual conflict maintains genetic variation in natural populations is a tremendous challengeit requires both identifying loci that harbor sexually antagonistic alleles and determining whether those alleles are maintained as stable polymorphisms (Mank, 2017). Doing so genome-wide is even harder because it is not tractable to identify sexually antagonistic alleles and test for stable polymorphisms at all loci. Dutoit etal. (2018) confront this challenge in a paper published in this issue of Molecular Ecology. Using gene expression and population genomic data from the collared flycatcher, Dutoit etal. (2018) identify associations and correlations between genomic signatures of balanced polymorphisms and sexual conflict."," RAYYAN-INCLUSION: {""Alfredo""=>""Excluded""} | RAYYAN-EXCLUSION-REASONS: perspective"
gale_perceived_2018,Perceived threats of infanticide reduce maternal allocation during lactation and lead to elevated oxidative damage in offspring,2018,1,1,FUNCTIONAL ECOLOGY,0269-8463,32,9,2158--2169,"Gale, Teagan and Garratt, Michael and Brooks, Robert C. month = sep,",10.1111/1365-2435.13146,,,,"1. Maternal investment is costly to the mother but essential to offspring survival in altrical species. Infanticide by novel males results in loss of maternal investment, and maternal strategies have evolved to mitigate these losses. One such maternal strategy, the Bruce effect, involves spontaneous abortion by females of some mammal species when exposed to a novel male during pregnancy. 2. In mice, the Bruce effect only occurs during early pregnancy, but we have previously found that female mice exposed to a novel male's scent in late pregnancy weaned smaller offspring. Here, we replicate that manipulation to resolve the cause of the reduced weaning weight and subsequent effects on offspring fitness. 3. Females exposed to an unfamiliar male's scent in late pregnancy spent significantly less time nursing their pups during lactation, suggesting that reduced maternal allocation contributes to slower offspring growth. The offspring with a reduced weaning weight exhibited catch-up growth and reached a normal weight at adulthood. These offspring, however, were found to bear oxidative damage in adulthood, revealing long-term effects on offspring condition. 4. We conclude that female mice strategically alter their investment in lactation in relation to the likelihood of infanticide, but that this results in long-term fitness costs to their offspring."," RAYYAN-INCLUSION: {""Alfredo""=>""Included""}"
guo_nutrient.specific_2018,Nutrient-specific compensation for seasonal cold stress in a free-ranging temperate colobine monkey,2018,1,1,FUNCTIONAL ECOLOGY,0269-8463,32,9,2170--2180,"Guo, Song-Tao and Hou, Rong and Garber, Paul A. and Raubenheimer, David and Righini, Nicoletta and Ji, Wei-Hong and Jay, Ollie and He, Shu-Jun and Wu, Fan and Li, Fang-Fang and Li, Bao-Guo month = sep,",10.1111/1365-2435.13134,,,,"1. Homeostatic responses of animals to environmentally induced changes in nutrient requirements provide a powerful basis for predictive ecological models, and yet, such responses are virtually unstudied in the wild. 2. We tested for macronutrient-specific compensatory feeding responses by free-ranging golden snub-nosed monkeys (Rhinopithecus roxellana) inhabiting high altitude temperate forests, where they experience a substantial difference in ambient temperature in cold winters vs. warmer springs. The monkeys had free access to natural foods throughout the year, and to ensure that any seasonal differences in nutrient intake were due to homeostatic compensation and not constraints on food availability, we studied the monkeys during periods in which they were provisioned with the same amount of supplementary foods in winter and spring. 3. Thermoregulatory energy costs in winter and spring were calculated using partitional calorimetric estimations of convective and radiative heat loss obtained from thermal imaging of free-ranging monkeys in situ. Daily nutrient intakes were measured using continuous focal follows (average 6.9hr/day) of free-ranging individuals (27 days in spring and 28 days in winter). 4. We used a nutritional geometry framework to integrate these data and test three predictions: (a) In order to remain thermoneutral (balance heat loss with heat expenditure), golden snub-nosed monkeys increase daily energy consumption during the winter compared to spring; (b) this increase is achieved specifically by increasing intake of the primary energetic nutrients, carbohydrate and lipid, relative to protein; and (c) the seasonal increase in ingested fat and carbohydrate calories will quantitatively match the additional thermoregulatory costs in winter compared with spring. 5. Our results showed that daily metabolisable energy intake in winter (721.5 kJ/mbm) was 1.8 times that in spring (399 kJ/mbm). As predicted, this difference was specific to fat and carbohydrate, whereas seasonal protein intake did not differ significantly. Winter consumption of fat and carbohydrate was 326 kJ/mbm per day greater than in spring, a value that closely matched the seasonal difference in the daily energetic costs of thermoregulation (329 kJ/mbm). 6. This is the first study to test for a match between nutrient-specific homeostatic compensation and environmentally induced perturbations in nutrient requirements in free-ranging animals and underpins the potential for the homeostasis framework to provide predictive power to ecological models."," RAYYAN-INCLUSION: {""Alfredo""=>""Included""}"
bell_sympatric_2018,"Sympatric {Parasites} {Have} {Similar} {Host}-{Associated}, but {Asynchronous}, {Patterns} of {Diversification",2018,1,1,AMERICAN NATURALIST,0003-0147,192,3,E106--E119,"Bell, Kayce C. and Demboski, John R. and Cook, Joseph A. month = sep,",10.1086/698300,,,,"Parasitism is a common symbiotic interaction across diverse natural systems. Using a comparative evolutionary approach, we investigated the contributions of both host phylogeny and abiotic factors toward diversification of phylogenetically independent endoparasites that inhabit essentially the same physical space. We tested for host-parasite and parasite-parasite phylogenetic concordance in western North American chipmunks (Rodentia: Sciuridae) and two distantly related species of pinworms (Nematoda: Oxyurida). Deep structure in molecular phylogenies revealed signals of host-associated divergence in both parasite species, while shallower phylogeographic structure varied between the two parasites. This suggests that although these parasites experienced similar landscapes and cyclic climate processes, temporally distinctive diversification events were associated with differences in the initiation of their association with host lineages. When climate cycles initiate diversification, partially congruent, but asynchronous, host-associated parasite phylogenies may emerge."," RAYYAN-INCLUSION: {""Alfredo""=>""Included""}"
marcionetti_first_2018,First draft genome of an iconic clownfish species ({Amphiprion} frenatus),2018,1,1,MOLECULAR ECOLOGY RESOURCES,1755-098X,18,5,1092--1101,"Marcionetti, Anna and Rossier, Victor and Bertr and , Joris A. M. and Litsios, Glenn and Salamin, Nicolas month = sep,",10.1111/1755-0998.12772,,,,"Clownfishes (or anemonefishes) form an iconic group of coral reef fishes, principally known for their mutualistic interaction with sea anemones. They are characterized by particular life history traits, such as a complex social structure and mating system involving sequential hermaphroditism, coupled with an exceptionally long lifespan. Additionally, clownfishes are considered to be one of the rare groups to have experienced an adaptive radiation in the marine environment. Here, we assembled and annotated the first genome of a clownfish species, the tomato clownfish (Amphiprion frenatus). We obtained 17,801 assembled scaffolds, containing a total of 26,917 genes. The completeness of the assembly and annotation was satisfying, with 96.5\% of the Actinopterygii Benchmarking Universal Single-Copy Orthologs (BUSCOs) being retrieved in A.frenatus assembly. The quality of the resulting assembly is comparable to other bony fish assemblies. This resource is valuable for advancing studies of the particular life history traits of clownfishes, as well as being useful for population genetic studies and the development of new phylogenetic markers. It will also open the way to comparative genomics. Indeed, future genomic comparison among closely related fishes may provide means to identify genes related to the unique adaptations to different sea anemone hosts, as well as better characterize the genomic signatures of an adaptive radiation."," RAYYAN-INCLUSION: {""Alfredo""=>""Included""}"
lind_evolutionary_2018,Evolutionary consequences of epigenetic inheritance,2018,1,1,HEREDITY,0018-067X,121,3,205--209,"Lind, Martin I. and Spagopoulou, Foteini month = sep,",10.1038/s41437-018-0113-y,,,,NA," RAYYAN-INCLUSION: {""Alfredo""=>""Excluded""} | RAYYAN-EXCLUSION-REASONS: review"
zajitschek_transgenerational_2018,Transgenerational effects of maternal sexual interactions in seed beetles,2018,1,1,HEREDITY,0018-067X,121,3,282--291,"Zajitschek, Susanne R. K. and Dowling, Damian K. and Head, Megan L. and Rodriguez-Exposito, Eduardo and Garcia-Gonzalez, Francisco month = sep,",10.1038/s41437-018-0093-y,,,,"Mating often bears large costs to females, especially in species with high levels of sexual conflict over mating rates. Given the direct costs to females associated with multiple mating, which include reductions in lifespan and lifetime reproductive success, past research focused on identifying potential indirect benefits (through increases in offspring fitness) that females may accrue. Far less attention has, however, been devoted to understanding how costs of sexual interactions to females may extend across generations. Hence, little is known about the transgenerational implications of variation in mating rates, or the net consequences of maternal sexual activities across generations. Using the seed beetle, Callosobruchus maculatus, a model system for the study of sexual conflict, we investigate the effects of mating with multiple males versus a single male, and tease apart effects due to sexual harassment and those due to mating per se, over three generations. A multigenerational analysis indicated that females that were exposed to ongoing sexual harassment and who also were permitted to mate with multiple males showed no difference in net fitness compared to females that mated just once without ongoing harassment. Intriguingly, however, females that were continually harassed, but permitted to mate just once, suffered a severe decline in net fitness compared to females that were singly (not harassed) or multiply mated (harassed, but potentially gaining benefits via mating with multiple males). Overall, the enhanced fitness in multiply mated compared to harassed females may indicate that multiple mating confers transgenerational benefits. These benefits may counteract, but do not exceed (i.e., we found no difference between singly and multiply mated females), the large transgenerational costs of harassment. Our study highlights the importance of examining transgenerational effects from an inclusive (looking at both indirect benefits but also costs) perspective, and the need to investigate transgenerational effects across several generations if we are to fully understand the consequences of sexual interactions, sexual conflict evolution, and the interplay of sexual conflict and multi-generational costs and benefits."," RAYYAN-INCLUSION: {""Alfredo""=>""Included""}"
bletz_disruption_2018,Disruption of skin microbiota contributes to salamander disease,2018,1,1,PROCEEDINGS OF THE ROYAL SOCIETY B-BIOLOGICAL SCIENCES,0962-8452,285,1885,NA,"Bletz, Molly C. and Kelly, Moira and Sabino-Pinto, Joana and Bales, Emma and Van Praet, Sarah and Bert, Wim and Boyen, Filip and Vences, Miguel and Steinfartz, Sebastian and Pasmans, Frank and Martel, An month = aug,",10.1098/rspb.2018.0758,,,,"Escalating occurrences of emerging infectious diseases underscore the importance of understanding microbiome-pathogen interactions. The amphibian cutaneous microbiome is widely studied for its potential to mitigate disease-mediated amphibian declines. Other microbial interactions in this system, however, have been largely neglected in the context of disease outbreaks. European fire salamanders have suffered dramatic population crashes as a result of the newly emerged Batrachochytrium salamandrivorans (Bsal). In this paper, we investigate microbial interactions on multiple fronts within this system. We show that wild, healthy fire salamanders maintain complex skin microbiotas containing Bsal-inhibitory members, but these community are present at a remarkably lowabundance. Through experimentation, we show that increasing bacterial densities of Bsal-inhibiting bacteria via daily addition slowed disease progression in fire salamanders. Additionally, we find that experimental-Bsal infection elicited subtle changes in the skin microbiome, with selected opportunistic bacteria increasing in relative abundance resulting in septicemic events that coincide with extensive destruction of the epidermis. These results suggest that fire salamander skin, in natural settings, maintains bacterial communities at numbers too low to confer sufficient protection against Bsal, and, in fact, the native skin microbiota can constitute a source of opportunistic bacterial pathogens that contribute to pathogenesis. By shedding light on the complex interaction between the microbiome and a lethal pathogen, these data put the interplay between skin microbiomes and a wildlife disease into a new perspective."," RAYYAN-INCLUSION: {""Alfredo""=>""Included""}"
derungs_environmental_2018,Environmental factors drive language density more in food-producing than in hunter-gatherer populations,2018,1,1,PROCEEDINGS OF THE ROYAL SOCIETY B-BIOLOGICAL SCIENCES,0962-8452,285,1885,NA,"Derungs, Curdin and Kohl, Martina and Weibel, Robert and Bickel, Balthasar month = aug,",10.1098/rspb.2017.2851,,,,"Linguistic diversity is a key aspect of human population diversity and shapes much of our social and cognitive lives. To a considerable extent, the distribution of this diversity is driven by environmental factors such as climate or coast access. An unresolved question is whether the relevant factors have remained constant over time. Here, we address this question at a global scale. We approximate the difference between pre-versus post-Neolithic populations by the difference between modern hunter-gatherer versus food-producing populations. Using a novel geostatistical approach of estimating language and language family densities, we show that environmental-chiefly climate factors-have driven the language density of food-producing populations considerably more strongly than the language density of hunter-gatherer populations. Current evidence suggests that the population dynamics of modern hunter-gatherers is very similar to that of what can be reconstructed from the Palaeolithic record. Based on this, we cautiously infer that the impact of environmental factors on language densities underwent a substantial change with the transition to agriculture. After this transition, the environmental impact on language diversity in food-producing populations has remained relatively stable since it can also be detected-albeit in slightly weaker form-in models that capture the reduced linguistic diversity during large-scale language spreads in the Mid-Holocene."," RAYYAN-INCLUSION: {""Alfredo""=>""Included""}"
jarrett_adaptive_2018,Adaptive evolution of synchronous egg-hatching in compensation for the loss of parental care,2018,1,1,PROCEEDINGS OF THE ROYAL SOCIETY B-BIOLOGICAL SCIENCES,0962-8452,285,1885,NA,"Jarrett, Benjamin J. M. and Rebar, Darren and Haynes, Hannah B. and Leaf, Mir and a R. and Halliwell, Chay and Kemp, Rachel and Kilner, Rebecca M. month = aug,",10.1098/rspb.2018.1452,,,,"Interactions among siblings are finely balanced between rivalry and cooperation, but the factors that tip the balance towards cooperation are incompletely understood. Previous observations of insect species suggest that (i) sibling cooperation is more likely when siblings hatch at the same time, and (ii) this is more common when parents provide little to no care. In this paper, we tested these ideas experimentally with the burying beetle, Nicrophorus vespilloides. Burying beetles convert the body of a small dead vertebrate into an edible nest for their larvae, and provision and guard their young after hatching. In our first experiment, we simulated synchronous or asynchronous hatching by adding larvae at different intervals to the carrion-breeding resource. We found that `synchronously' hatched broods survived better than `asynchronously' hatched broods, probably because `synchronous hatching' generated larger teams of larvae, that together worked more effectively to penetrate the carrion nest and feed upon it. In our second experiment, we measured the synchronicity of hatching in experimental populations that had evolved for 22 generations without any post-hatching care, and control populations that had evolved in parallel with post-hatching care. We found that larvae were more likely to hatch earlier, and at the same time as their broodmates, in the experimental populations that evolved without post-hatching care. We suggest that synchronous hatching enables offspring to help each other when parents are not present to provide care. However, we also suggest that greater levels of cooperation among siblings cannot compensate fully for the loss of parental care."," RAYYAN-INCLUSION: {""Alfredo""=>""Included""}"
richardson_unpredictable_2018,Unpredictable movement as an anti-predator strategy,2018,1,1,PROCEEDINGS OF THE ROYAL SOCIETY B-BIOLOGICAL SCIENCES,0962-8452,285,1885,NA,"Richardson, Graham and Dickinson, Patrick and Burman, Oliver H. P. and Pike, Thomas W. month = aug,",10.1098/rspb.2018.1112,,,,"Prey animals have evolved a wide variety of behaviours to combat the threat of predation, and these have been generally well studied. However, one of the most common and taxonomically widespread antipredator behaviours of all has, remarkably, received almost no experimental attention: so-called `protean' behaviour. This is behaviour that is sufficiently unpredictable to prevent a predator anticipating in detail the future position or actions of its prey. In this study, we used human `predators' participating in 3D virtual reality simulations to test how protean (i.e. unpredictable) variation in prey movement affects participants' ability to visually target them as they move (a key determinant of successful predation). We found that targeting accuracy was significantly predicted by prey movement path complexity, although, surprisingly, there was little evidence that high levels of unpredictability in the underlying movement rules equated directly to decreased predator performance. Instead, the specific movement rules differed in how they impacted on targeting accuracy, with the efficacy of protean variation in one element depending on the values of the remaining elements. These findings provide important insights into the understudied phenomenon of protean antipredator behaviour, which are directly applicable to predator-prey dynamics within a broad range of taxa."," RAYYAN-INCLUSION: {""Alfredo""=>""Included""}"
cornwall_resistance_2018,Resistance of corals and coralline algae to ocean acidification: physiological control of calcification under natural {pH} variability,2018,1,1,PROCEEDINGS OF THE ROYAL SOCIETY B-BIOLOGICAL SCIENCES,0962-8452,285,1884,NA,"Cornwall, C. E. and Comeau, S. and DeCarlo, T. M. and Moore, B. and D'Alexis, Q. and McCulloch, M. T. month = aug,",10.1098/rspb.2018.1168,,,,"Ocean acidification is a threat to the continued accretion of coral reefs, though some undergo daily fluctuations in pH exceeding declines predicted by 2100. We test whether exposure to greater pH variability enhances resistance to ocean acidification for the coral Goniopora sp. and coralline alga Hydrolithon reinboldii from two sites: one with low pH variability (less than 0.15 units daily; Shell Island) and a site with high pH variability (up to 1.4 pH units daily; Tallon Island). We grew populations of both species for more than 100 days under a combination of differing pH variability (high/low) and means (ambient pH 8.05/ocean acidification pH 7.65). Calcification rates of Goniopora sp. were unaffected by the examined variables. Calcification rates of H. reinboldii were significantly faster in Tallon than in Shell Island individuals, and Tallon Island individuals calcified faster in the high variability pH 8.05 treatment compared with all others. Geochemical proxies for carbonate chemistry within the calcifying fluid (cf) of both species indicated that only mean seawater pH influenced pH(cf). pH treatments had no effect on proxies for Omega(cf). These limited responses to extreme pH treatments demonstrate that some calcifying taxa may be capable of maintaining constant rates of calcification under ocean acidification by actively modifying Omega(cf)."," RAYYAN-INCLUSION: {""Alfredo""=>""Included""}"
miles_urban_2018,Urban hubs of connectivity: contrasting patterns of gene flow within and among cities in the western black widow spider,2018,1,1,PROCEEDINGS OF THE ROYAL SOCIETY B-BIOLOGICAL SCIENCES,0962-8452,285,1884,NA,"Miles, Lindsay S. and Dyer, Rodney J. and Verrelli, Brian C. month = aug,",10.1098/rspb.2018.1224,,,,"As urbanization drastically alters the natural landscape and generates novel habitats within cities, the potential for changes to gene flow for urban-dwelling species increases. The western black widow spider (Latrodectus hesperus) is a medically relevant urban adapter pest species, for which we have previously identified population genetic signatures consistent with urbanization facilitating gene flow, likely due to human-mediated transport. Here, in an analysis of 1.9 million genome-wide SNPs, we contrast broad-scale geographical analyses of 10 urban and 11 non-urban locales with fine-scale within-city analyses including 30 urban locales across the western USA. These hierarchical datasets enable us to test hypotheses of how urbanization impacts multiple urban cities and their genetic connectivity at different spatial scales. Coupled fine-scale and broad-scale analyses reveal contrasting patterns of high and low genetic differentiation among locales within cities as a result of low and high genetic connectivity, respectively, of these cities to the overall population network. We discuss these results as they challenge the use of cities as replicates of urban eco-evolution, and have implications for conservation and human health in a rapidly growing urban habitat."," RAYYAN-INCLUSION: {""Alfredo""=>""Included""}"
