key,title,year,month,day,journal,issn,volume,issue,pages,authors,url,language,publisher,location,abstract,notes
rinehart_habitat_2018,Habitat use is linked to resource-specific performance of an ecologically important marsh predator,2018,1,1,ECOSPHERE,2150-8925,9,5,NA,"Rinehart, S. A. and Long, J. D. month = may,",10.1002/ecs2.2273,,,,"It is commonly assumed that animals should preferentially use habitats that enhance their individual performance. However, there have been few attempts to empirically test the relationship between an animals' habitat use and performance. This is surprising, since knowing about this connection should enhance our ability to predict the local population dynamics of ecologically important species. Here, we used three primary experiments to assess the relationship between habitat use and performance for an important insect consumer (ladybeetles). First, we used field manipulations of resource availability (i.e., scale insects and cordgrass pollen) to examine the habitat use of ladybeetle predators. Second, we conducted a series of no-choice laboratory assays to compare the performance (fecundity and longevity) of ladybeetles on these different resources. Third, we quantified adult ladybeetle preference for olfactory cues from cordgrass with and without scale insects using a Y-tube olfactometer. In the field, adult ladybeetles selectively used plots containing scale insects. In the laboratory, diets containing scale insects maximized both adult and larval ladybeetle longevity, and adult fecundity. Adult ladybeetles were attracted to chemical cues associated with scale insects over distances of 10s of centimeters. Overall, our findings suggest that the habitat use and performance of ladybeetles are strongly linked, with ladybeetles preferentially using habitats that maximize their individual performance."," RAYYAN-INCLUSION: {""Alfredo""=>""Included""}"
skoeld_bounding_2018,Bounding reproductive rates in state-space models for animal population dynamics,2018,1,1,ECOSPHERE,2150-8925,9,5,NA,"Skoeld, Martin and Knape, Jonas month = may,",10.1002/ecs2.2215,,,,"Time-series models applied in the study of animal population dynamics commonly assume linearity on the log-scale, leading to log-normally distributed rates of increase. While this is often computationally convenient, in particular when performing statistical inference in the presence of observation error, it may lead to unrealistic predictions for animals with a limited reproduction. We introduce a model that includes an explicit bound on the reproductive rate of an individual, and apply this to a population time series of ungulates in Kruger National Park, South Africa. Due to observational error, the year-to-year increases in animal counts occasionally exceeded the maximal reproductive rate of the animals. In such cases, the traditional unbounded model showed a tendency of overfitting data, leading to unrealistic predictions of the underlying population increase. An observed increase above the maximal reproductive rate also provides empirical confirmation that observation error exists. The model with an explicit bound was able to utilize this in order to separate observational error from population process noise, which the traditional unbounded model was unable to do. We conclude that enforcing a strict upper bound on the reproductive rate of an animal population model may lead to more realistic statistical inference than commonly applied log-linear models when an explicit bound on reproductive rate is known. We further conclude that introducing a bound on reproduction can greatly assist in separating observational error and population process noise for slow life histories, or more generally, when the rate of sampling is high compared to reproductive rates."," RAYYAN-INCLUSION: {""Alfredo""=>""Included""}"
kleinhesselink_response_2018,The response of big sagebrush ({Artemisia} tridentata) to interannual climate variation changes across its range,2018,1,1,ECOLOGY,0012-9658,99,5,1139--1149,"Kleinhesselink, Andrew R. and Adler, Peter B. month = may,",NA,,,,"Understanding how annual climate variation affects population growth rates across a species' range may help us anticipate the effects of climate change on species distribution and abundance. We predict that populations in warmer or wetter parts of a species' range should respond negatively to periods of above average temperature or precipitation, respectively, whereas populations in colder or drier areas should respond positively to periods of above average temperature or precipitation. To test this, we estimated the population sensitivity of a common shrub species, big sagebrush (Artemisia tridentata), to annual climate variation across its range. Our analysis includes 8,175 observations of year-to-year change in sagebrush cover or production from 131 monitoring sites in western North America. We coupled these observations with seasonal weather data for each site and analyzed the effects of spring through fall temperatures and fall through spring accumulated precipitation on annual changes in sagebrush abundance. Sensitivity to annual temperature variation supported our hypothesis: years with above average temperatures were beneficial to sagebrush in colder locations and detrimental to sagebrush in hotter locations. In contrast, sensitivity to precipitation did not change significantly across the distribution of sagebrush. This pattern of responses suggests that regional abundance of this species may be more limited by temperature than by precipitation. We also found important differences in how the ecologically distinct subspecies of sagebrush responded to the effects of precipitation and temperature. Our model predicts that a short-term temperature increase could produce an increase in sagebrush cover at the cold edge of its range and a decrease in cover at the warm edge of its range. This prediction is qualitatively consistent with predictions from species distribution models for sagebrush based on spatial occurrence data, but it provides new mechanistic insight and helps estimate how much and how fast sagebrush cover may change within its range."," RAYYAN-INCLUSION: {""Alfredo""=>""Included""}"
ramakers_maternal_2018,Maternal {Effects} in a {Wild} {Songbird} {Are} {Environmentally} {Plastic} but {Only} {Marginally} {Alter} the {Rate} of {Adaptation,2018,1,1,AMERICAN NATURALIST,0003-0147,191,5,E144--E158,"Ramakers, Jip J. C. and Cobben, Marleen M. P. and Bijma, Piter and Reed, Thomas E. and Visser, Marcel E. and Gienapp, Phillip month = may,",10.1086/696847,,,,"Despite ample evidence for the presence of maternal effects (MEs) in a variety of traits and strong theoretical indications for their evolutionary consequences, empirical evidence to what extent MEs can influence evolutionary responses to selection remains ambiguous. We tested the degree to which MEs can alter the rate of adaptation of a key life-history trait, clutch size, using an individual-based model approach parameterized with experimental data from a long-term study of great tits (Parus major). We modeled two types of MEs: (i) an environmentally plastic ME, in which the relationship between maternal and offspring clutch size depended on the maternal environment via offspring condition, and (ii) a fixed ME, in which this relationship was constant. Although both types of ME affected the rate of adaptation following an abrupt environmental shift, the overall effects were small. We conclude that evolutionary consequences of MEs are modest at best in our study system, at least for the trait and the particular type of ME we considered here. A closer link between theoretical and empirical work on MEs would hence be useful to obtain accurate predictions about the evolutionary consequences of MEs more generally."," RAYYAN-INCLUSION: {""Alfredo""=>""Included""}"
sullivan_field_2018,Field methods for sampling tree height for tropical forest biomass estimation,2018,1,1,METHODS IN ECOLOGY AND EVOLUTION,2041-210X,9,5,1179--1189,"Sullivan, Martin J. P. and Lewis, Simon L. and Hubau, Wannes and Qie, Lan and Baker, Timothy R. and Banin, Lindsay F. and Chave, Jerome and Cuni-Sanchez, Aida and Feldpausch, Ted R. and Lopez-Gonzalez, Gabriela and Arets, Eric and Ashton, Peter and Bastin, Jean-Francois and Berry, Nicholas J. and Bogaert, Jan and Boot, Rene and Brearley, Francis Q. and Brienen, Roel and Burslem, David F. R. P. and de Canniere, Charles and Chudomelova, Marketa and Dancak, Martin and Ewango, Corneille and Hedl, Radim and Lloyd, Jon and Makana, Jean-Remy and Malhi, Yadvinder and Marimon, Beatriz S. and Marimon Junior, Ben Hur and Metali, Faizah and Moore, Sam and Nagy, Laszlo and Vargas, Percy Nunez and Pendry, Colin A. and Ramirez-Angulo, Hirma and Reitsma, Jan and Rutishauser, Ervan and Abu Salim, Kamariah and Sonke, Bonaventure and Sukri, Rahayu S. and Sunderl and , Terry and Svatek, Martin and Umunay, Peter M. and Martinez, Rodolfo Vasquez and Vernimmen, Ronald R. E. and Torre, Emilio Vilanova and Vleminckx, Jason and Vos, Vincent and Phillips, Oliver L. month = may,",10.1111/2041-210X.12962,,,,"1. Quantifying the relationship between tree diameter and height is a key component of efforts to estimate biomass and carbon stocks in tropical forests. Although substantial site-to-site variation in height-diameter allometries has been documented, the time consuming nature of measuring all tree heights in an inventory plot means that most studies do not include height, or else use generic pan-tropical or regional allometric equations to estimate height. 2. Using a pan-tropical dataset of 73 plots where at least 150 trees had in-field ground-based height measurements, we examined how the number of trees sampled affects the performance of locally derived height-diameter allometries, and evaluated the performance of different methods for sampling trees for height measurement. 3. Using cross-validation, we found that allometries constructed with just 20 locally measured values could often predict tree height with lower error than regional or climate-based allometries (mean reduction in prediction error = 0.46 m). The predictive performance of locally derived allometries improved with sample size, but with diminishing returns in performance gains when more than 40 trees were sampled. Estimates of stand-level biomass produced using local allometries to estimate tree height show no over- or under-estimation bias when compared with biomass estimates using field measured heights. We evaluated five strategies to sample trees for height measurement, and found that sampling strategies that included measuring the heights of the ten largest diameter trees in a plot outperformed (in terms of-resulting in local height-diameter models with low height prediction error) entirely random or diameter size-class stratified approaches. 4. Our results indicate that even limited sampling of heights can be used to refine height-diameter allometries. We recommend aiming for a conservative threshold of sampling 50 trees per location for height measurement, and including the ten trees with the largest diameter in this sample."," RAYYAN-INCLUSION: {""Alfredo""=>""Included""}"
wells_high.quality_2018,A high-quality pedigree and genetic markers both reveal inbreeding depression for quality but not survival in a cooperative mammal,2018,1,1,MOLECULAR ECOLOGY,0962-1083,27,9,2271--2288,"Wells, David A. and Cant, Michael A. and Nichols, Hazel J. and Hoffman, Joseph I. month = may,",10.1111/mec.14570,,,,"Inbreeding depression, the reduced fitness of offspring of closely related parents, is commonplace in both captive and wild populations and has important consequences for conservation and mating system evolution. However, because of the difficulty of collecting pedigree and life-history data from wild populations, relatively few studies have been able to compare inbreeding depression for traits at different points in the life cycle. Moreover, pedigrees give the expected proportion of the genome that is identical by descent (IBDg) whereas in theory with enough molecular markers realized IBDg can be quantified directly. We therefore investigated inbreeding depression for multiple life-history traits in a wild population of banded mongooses using pedigree-based inbreeding coefficients (f(ped)) and standardized multilocus heterozygosity (sMLH) measured at 35-43 microsatellites. Within an information theoretic framework, we evaluated support for either f(ped) or sMLH as inbreeding terms and used sequential regression to determine whether the residuals of sMLH on f(ped) explain fitness variation above and beyond f(ped). We found no evidence of inbreeding depression for survival, either before or after nutritional independence. By contrast, inbreeding was negatively associated with two quality-related traits, yearling body mass and annual male reproductive success. Yearling body mass was associated with f(ped) but not sMLH, while male annual reproductive success was best explained by both f(ped) and residual sMLH. Thus, our study not only uncovers variation in the extent to which different traits show inbreeding depression, but also reveals trait-specific differences in the ability of pedigrees and molecular markers to explain fitness variation and suggests that for certain traits, genetic markers may capture variation in realized IBDg above and beyond the pedigree expectation."," RAYYAN-INCLUSION: {""Alfredo""=>""Included""}"
kunin_upscaling_2018,Upscaling biodiversity: estimating the species-area relationship from small samples,2018,1,1,ECOLOGICAL MONOGRAPHS,0012-9615,88,2,170--187,"Kunin, William E. and Harte, John and He, Fangliang and Hui, Cang and Jobe, R. Todd and Ostling, Annette and Polce, Chiara and Sizling, Arnost and Smith, Adam B. and Smith, Krister and Smart, Simon M. and Storch, David and Tjorve, Even and Ugl and , Karl-Inne and Ulrich, Werner and Varma, Varun month = may,",10.1002/ecm.1284,,,,"The challenge of biodiversity upscaling, estimating the species richness of a large area from scattered local surveys within it, has attracted increasing interest in recent years, producing a wide range of competing approaches. Such methods, if successful, could have important applications to multi-scale biodiversity estimation and monitoring. Here we test 19 techniques using a high quality plant data set: the GB Countryside Survey 1999, detailed surveys of a stratified random sample of British landscapes. In addition to the full data set, a set of geographical and statistical subsets was created, allowing each method to be tested on multiple data sets with different characteristics. The predictions of the models were tested against the true species-area relationship for British plants, derived from contemporaneously surveyed national atlas data. This represents a far more ambitious test than is usually employed, requiring 5-10 orders of magnitude in upscaling. The methods differed greatly in their performance; while there are 2,326 focal plant taxa recorded in the focal region, up-scaled species richness estimates ranged from 62 to 11,593. Several models provided reasonably reliable results across the 16 test data sets: the Shen and He and the Ulrich and Ollik models provided the most robust estimates of total species richness, with the former generally providing estimates within 10\% of the true value. The methods tested proved less accurate at estimating the shape of the species-area relationship (SAR) as a whole; the best single method was Hui's Occupancy Rank Curve approach, which erred on average by {\textless}20\%. A hybrid method combining a total species richness estimate (from the Shen and He model) with a downscaling approach (the Sizling model) proved more accurate in predicting the SAR (mean relative error 15.5\%) than any of the pure upscaling approaches tested. There remains substantial room for improvement in upscaling methods, but our results suggest that several existing methods have a high potential for practical application to estimating species richness at coarse spatial scales. The methods should greatly facilitate biodiversity estimation in poorly studied taxa and regions, and the monitoring of biodiversity change at multiple spatial scales."," RAYYAN-INCLUSION: {""Alfredo""=>""Included""}"
de_boeck_patterns_2018,Patterns and drivers of biodiversity-stability relationships under climate extremes,2018,1,1,JOURNAL OF ECOLOGY,0022-0477,106,3,890--902,"De Boeck, Hans J. and Bloor, Juliette M. G. and Kreyling, Juergen and Ransijn, Johannes C. G. and Nijs, Ivan and Jentsch, Anke and Zeiter, Michaela month = may,",10.1111/1365-2745.12897,,,,"Interactions between biodiversity loss and climate change present significant challenges for research, policy and management of ecosystems. Evidence suggests that high species diversity tends to increase plant community stability under interannual climate fluctuations and mild dry and wet events, but the overall pattern of diversity-stability relationships under climate extremes is unclear. We comprehensively review results from observational and experimental studies to assess the importance of diversity effects for ecosystem function under climate extremes. Both the broad literature review and a meta-analysis focused on the effects of extreme precipitation events on above-ground biomass reveal no significant interaction between species richness and climate extremes. Causes for variation in diversity effects under climate extremes are explored, from stress thresholds to biotic interactions and community assembly, and we consider how these may modulate the outcomes of biodiversity-stability relationships. We also examine how specific characteristics of climate extremes and timing of measurements may interact with mechanisms of diversity-stability relationships.Synthesis. Hypotheses tailored to the complexity of diversity effects, the implementation of standardised experiments and the use of trait-based biodiversity measures rather than species richness should lead to better causal understanding of whether and how biodiversity may protect ecosystems from adverse effects of climate extremes."," RAYYAN-INCLUSION: {""Alfredo""=>""Included""}"
reif_competition.driven_2018,Competition-driven niche segregation on a landscape scale: {Evidence} for escaping from syntopy towards allotopy in two coexisting sibling passerine species,2018,1,1,JOURNAL OF ANIMAL ECOLOGY,0021-8790,87,3,774--789,"Reif, Jiri and Reifova, Radka and Skoracka, Anna and Kuczynski, Lechoslaw month = may,",10.1111/1365-2656.12808,,,,"1. The role of interspecific competition for generating patterns in species' distribution is hotly debated and studies taking into account processes occurring at both large and small spatial scales are almost missing. Theoretically, competition between species with overlapping niches should result in divergence of their niches in sympatry to reduce the costs of competition. Many species show a mosaic distribution within sympatric zones, with the syntopic sites occupied by both species, and allotopic sites where only one species occurs. It is unclear whether such mosaics arise as a consequence of competition-driven niche segregation or due to the decline of their abundances towards range edges driven by environmental gradients. 2. If the interspecific competition matters, we should observe (1) a shift in habitat preferences of one or both species between syntopy and allotopy, and (2) between allopatry and allotopy. Moreover, (3) species should show greater divergence in their habitat preferences in allotopy than in allopatry where (4) no differences in habitat preferences may occur. Finally, (5) shifts should be generally greater in the competitively subordinate species than in the dominant species. 3. We used a unique dataset on abundance of two closely related passerine species, the Common Nightingale (Luscinia megarhynchos) and the Thrush Nightingale (Luscinia luscinia), collected across their syntopy, allotopy and allopatry. The predictions were tested within a generalized mixed-effects modelling framework. 4. After accounting for environmental gradients perpendicular to the species' contact zone, we found a strong support for all but one prediction. Habitat preferences of both species shifted markedly between syntopy and allotopy, as well as between allopatry and allotopy. Whereas the species preferred the same habitats in allopatry, their preferences became strikingly different in allotopy where the abundance of the Common Nightingale increased towards dry and warm sites with low coverage of pastures, while the abundance of the Thrush Nightingale showed exactly opposite trends. Fifth prediction was not supported. 5. Our results indicate that the competition between closely related species can result in considerable changes in habitat use across their geographic ranges accompanied with divergence in their habitat preferences in sympatry. Here, the species escape from competition to allotopic sites covered by habitats avoided by the competitor. Therefore, we argue that the interspecific competition is an important driver of species' distribution at both large and small spatial scales."," RAYYAN-INCLUSION: {""Alfredo""=>""Included""}"
green_dynamic_2018,"Dynamic occupancy modelling reveals a hierarchy of competition among fishers, grey foxes and ringtails",2018,1,1,JOURNAL OF ANIMAL ECOLOGY,0021-8790,87,3,813--824,"Green, David S. and Matthews, Sean M. and Swiers, Robert C. and Callas, Richard L. and Yaeger, J. Scott and Farber, Stuart L. and Schwartz, Michael K. and Powell, Roger A. month = may,",10.1111/1365-2656.12791,,,,"1. Determining how species coexist is critical for understanding functional diversity, niche partitioning and interspecific interactions. Identifying the direct and indirect interactions among sympatric carnivores that enable their coexistence is particularly important to elucidate because they are integral for maintaining ecosystem function. 2. We studied the effects of removing nine fishers (Pekania pennanti) on their population dynamics and used this perturbation to elucidate the interspecific interactions among fishers, grey foxes (Urocyon cinereoargenteus) and ringtails (Bassariscus astutus). Grey foxes (family: Canidae) are likely to compete with fishers due to their similar body sizes and dietary overlap, and ringtails (family: Procyonidae), like fishers, are semi-arboreal species of conservation concern. We used spatial capture-recapture to investigate fisher population numbers and dynamic occupancy models that incorporated interspecific interactions to investigate the effects members of these species had on the colonization and persistence of each other's site occupancy. 3. The fisher population showed no change in density for up to 3 years following the removals of fishers for translocations. In contrast, fisher site occupancy decreased in the years immediately following the translocations. During this same time period, site occupancy by grey foxes increased and remained elevated through the end of the study. 4. We found a complicated hierarchy among fishers, foxes and ringtails. Fishers affected grey fox site persistence negatively but had a positive effect on their colonization. Foxes had a positive effect on ringtail site colonization. Thus, fishers were the dominant small carnivore where present and negatively affected foxes directly and ringtails indirectly. 5. Coexistence among the small carnivores we studied appears to reflect dynamic spatial partitioning. Conservation and management efforts should investigate how intraguild interactions may influence the recolonization of carnivores to previously occupied landscapes."," RAYYAN-INCLUSION: {""Alfredo""=>""Included""}"
